PubmedID,Title,Publication Date,Authors,Corresponding Author Email
40066668,What Is the Current Management of Osteoradionecrosis of the Temporal Bone Following Head and Neck Cancer Radiotherapy?,2025,"Shravani Pathak, Richard V Smith",N/A
40066668,Clinical Significance of Bone Metastases in Pleural Mesothelioma.,2025,"Mitsutomi Miyake, Kozo Kuribayashi, Hiroshi Doi, Aki Kubota, Taiichiro Otuski, Yoshiki Negi, Koji Mikami, Ryo Takahashi, Akifumi Nakamura, Yasuhiro Nakajima, Daichi Fujimoto, Kazuhiro Kitajima, Toshiyuki Minami, Takashi Kijima",N/A
40066668,Identification and functional characterization of T-cell exhaustion-associated lncRNA AL031775.1 in osteosarcoma: a novel therapeutic target.,2025,"Yameng Wang, Jinghong Yuan, Keying Guo, Zhuoer Zhang, Junchao Zhu, Shahrzad Arya, Guowen Huang, Shengqin Li, Qi Chen, Xijuan Liu, Jingyu Jia",N/A
40066668,Selenium-modified hydroxyapatite titanium coating: enhancing osteogenesis and inhibiting cancer in bone invasion by head and neck squamous cell carcinoma.,2025,"Xutao Wen, Qin Zhou, Sihan Lin, Huaming Mai, Ling Zhang",N/A
40066668,Combining a 9-month tailored physical exercise program with osimertinib and denosumab in a patient affected by advanced NSCLC with multiple osteolytic bone lesions: A case report.,2025,"Anita Borsati, Christian Ciurnelli, Lorenzo Belluomini, Marco Sposito, Jessica Insolda, Linda Toniolo, Ilaria Trestini, Daniela Tregnago, Michele Milella, Federico Schena, Sara Pilotto, Alice Avancini",N/A
