PubmedID,Title,Publication Date,Non-academic Author(s),Company Affiliation(s),Corresponding Author Email
40066698,Single-cell profiling reveals the intratumor heterogeneity and immunosuppressive microenvironment in cervical adenocarcinoma.,2025 Mar 11,N/A,N/A,N/A
40066676,Arid4a Suppresses Breast Tumor Metastasis by Enhancing MTSS1 Expression via mRNA Stability.,2025 Mar,N/A,N/A,N/A
40066672,Multifunctional Liposomes with Enhanced Stability for Imaging-Guided Cancer Chemodynamic and Photothermal Therapy.,2025 Mar 11,N/A,N/A,N/A
40066668,What Is the Current Management of Osteoradionecrosis of the Temporal Bone Following Head and Neck Cancer Radiotherapy?,2025 Mar 11,N/A,N/A,N/A
40066659,Inhibition of HDAC4 in granulosa cells improved co-cultured oocyte maturation in vitro independent of LH in porcine.,2025 Mar 11,N/A,N/A,N/A
